placeholder,RUN015_source_status,RUN016_manual_task,priority,current_candidate_key,current_candidate_title,current_candidate_type,verified_source_available,repo_relative_source_available,absolute_path_issue,final_reference_key,final_reference_entry,final_reference_status,affected_sections,required_action,notes
[REF_BRFG_DRAWING],LOCAL_FILE_FOUND_NEEDS_MANUFACTURER_METADATA_CONFIRMATION,Confirm manufacturer metadata / authorized drawing provenance.,high,LOCAL_BRFGL1_DRAWING_FILES,BRFGL1-126/1250-4 Drawing1 DWG/DXF/PNG local files,local drawing/CAD file,false,false,true,,,LOCAL_PATH_ONLY_NOT_PORTABLE,1; 3.1,Confirm manufacturer metadata / authorized drawing provenance.,No formal reference entry is emitted unless source metadata and claim support are verified.
[REF_IEC_60137],TRACEABILITY_RECORD_EXISTS_NEEDS_STANDARD_TEXT_CONFIRMATION,Confirm official IEC 60137 text or official scope page.,high,IEC60137_2017_WEBSTORE_TRACEABILITY_RECORD,IEC 60137 official webstore/source traceability record,standard/source traceability entry,false,false,false,,,NEEDS_MANUAL_CONFIRMATION,1; 3.1,Confirm official IEC 60137 text or official scope page.,No formal reference entry is emitted unless source metadata and claim support are verified.
[REF_RIP_BUSHING_THERMAL],LOCAL_PDF_CANDIDATES_FOUND_NEEDS_CONTENT_AND_BIBLIOGRAPHIC_CONFIRMATION,Verify local RIP/bushing thermal literature and final bibliographic metadata.,medium,LOCAL_LIT_10_2021_Electro_thermal_comprehensive_analysis_method_for_the_resin_impregnated_; LOCAL_LIT_11_2022_3_D_thermal_analysis_for_the_valve_side_bushings_of_HVDC_converter_trans; LOCAL_LIT_18_2026_Effects_of_extreme_ambient_temperatures_on_electro_thermal_fields_of_val; LOCAL_LIT_19_2025_Fast_computation_of_electro_thermal_coupling_field_of_400_kV_converter_t; LOCAL_LIT_1_2009_Evaluation_of_thermal_transient_and_overload_capability_of_high_voltage_b; LOCAL_LIT_2_2010_Temperature_distribution_in_resin_impregnated_paper_insulation_for_transf; LOCAL_LIT_3_2014_Inner_insulation_structure_optimization_of_UHV_RIP_oil_SF6_bushing_using_; LOCAL_LIT_4_2016_Heat_analysis_of_the_power_transformer_bushings_using_the_finite_element_; LOCAL_LIT_5_2017_Heat_analysis_of_the_power_transformer_bushings_in_the_transient_and_stea; LOCAL_LIT_6_2016_3_D_coupled_electromagnetic_fluid_thermal_analysis_of_epoxy_impregnated_p; LOCAL_LIT_7_2017_Regularity_analysis_of_the_temperature_distribution_of_epoxy_impregnated_; LOCAL_LIT_8_2017_A_novel_dissipating_heat_structure_of_converter_transformer_RIP_bushings_,2021-Electro-thermal comprehensive analysis method for the resin impregnated paper valve-side bushing of HVDC converter transformer; 2022-3-D thermal analysis for the valve-side bushings of HVDC converter transformer and application in the evaluation of current-carrying connections defects; 2026-Effects of extreme ambient temperatures on electro-thermal fields of valve-side bushings under actual operating conditions; 2025-Fast computation of electro-thermal coupling field of 400 kV converter transformer valve-side bushing based on proper orthogonal decomposition method; 2009-Evaluation of thermal transient and overload capability of high-voltage bushings with ATP; 2010-Temperature distribution in resin impregnated paper insulation for transformer bushings; 2014-Inner insulation structure optimization of UHV RIP oil-SF6 bushing using electro-thermal simulation and advanced equal margin design method; 2016-Heat analysis of the power transformer bushings using the finite element method; 2017-Heat analysis of the power transformer bushings in the transient and steady states considering load variations; 2016-3-D coupled electromagnetic-fluid-thermal analysis of epoxy impregnated paper converter transformer bushings; 2017-Regularity analysis of the temperature distribution of epoxy impregnated paper converter transformer bushings; 2017-A novel dissipating heat structure of converter transformer RIP bushings based on 3-D electromagnetic-fluid-thermal analysis,local peer-reviewed PDF candidates,false,false,true,,,LOCAL_PATH_ONLY_NOT_PORTABLE,1; 2; 3.2,Verify local RIP/bushing thermal literature and final bibliographic metadata.,No formal reference entry is emitted unless source metadata and claim support are verified.
[REF_DIELECTRIC_LOSS_THEORY],PARTIALLY_RESOLVED_WITH_LOCAL_PDFS_NEEDS_THEORY_REFERENCE_CONFIRMATION,Confirm dielectric-loss equation and RMS convention.,high,LOCAL_LIT_13_2023_Investigation_on_hot_spot_temperature_of_resin_impregnated_paper_high_vo; LOCAL_LIT_15_2019_Dielectric_response_and_space_charge_in_epoxy_impregnated_paper_composit; LOCAL_LIT_16_2015_Dielectric_properties_of_multi_layer_epoxy_resin_impregnated_crepe_paper; LOCAL_LIT_22_2019_Diagnostic_challenges_in_dielectric_loss_assessment_and_interpretation_a,2023-Investigation on hot spot temperature of resin-impregnated paper high-voltage bushing based upon dielectric loss; 2019-Dielectric response and space charge in epoxy impregnated paper composite laminates; 2015-Dielectric properties of multi-layer epoxy resin-impregnated crepe paper composites; 2019-Diagnostic challenges in dielectric loss assessment and interpretation-a review,local dielectric PDF candidates; theory reference still needed,false,false,true,,,LOCAL_PATH_ONLY_NOT_PORTABLE,2; 3.3; 4.4,Confirm dielectric-loss equation and RMS convention.,No formal reference entry is emitted unless source metadata and claim support are verified.
[REF_CONDENSER_BUSHING_ELECTROSTATICS],LOCAL_PDF_CANDIDATES_FOUND_NEEDS_CONTENT_AND_BIBLIOGRAPHIC_CONFIRMATION,Verify condenser-screen electrostatic modeling support.,medium,LOCAL_LIT_10_2021_Electro_thermal_comprehensive_analysis_method_for_the_resin_impregnated_; LOCAL_LIT_3_2014_Inner_insulation_structure_optimization_of_UHV_RIP_oil_SF6_bushing_using_,2021-Electro-thermal comprehensive analysis method for the resin impregnated paper valve-side bushing of HVDC converter transformer; 2014-Inner insulation structure optimization of UHV RIP oil-SF6 bushing using electro-thermal simulation and advanced equal margin design method,local peer-reviewed PDF candidates,false,false,true,,,LOCAL_PATH_ONLY_NOT_PORTABLE,2; 3.3,Verify condenser-screen electrostatic modeling support.,No formal reference entry is emitted unless source metadata and claim support are verified.
[REF_COMSOL_FLOATING_POTENTIAL],UNRESOLVED,Find official COMSOL Floating Potential / zero net charge documentation.,high,,,official software documentation,false,false,false,,,UNRESOLVED,3.3,Find official COMSOL Floating Potential / zero net charge documentation.,No formal reference entry is emitted unless source metadata and claim support are verified.
[REF_MESH_CONVERGENCE],UNRESOLVED,Find finite-element mesh convergence verification reference.,high,,,"textbook, standard, or numerical-method paper",false,false,false,,,UNRESOLVED,3.5; 4.6,Find finite-element mesh convergence verification reference.,No formal reference entry is emitted unless source metadata and claim support are verified.
[REF_RISK_DIAGNOSTIC_METHOD],PARTIALLY_RESOLVED_WITH_LOCAL_APPLICATION_PDFS_NEEDS_METHOD_REFERENCE,Find diagnostic screening/risk-zoning method support.,medium,LOCAL_LIT_11_2022_3_D_thermal_analysis_for_the_valve_side_bushings_of_HVDC_converter_trans; LOCAL_LIT_12_2020_Novel_heat_pipe_current_carrying_tube_of_RIP_valve_side_bushing_in_conve,2022-3-D thermal analysis for the valve-side bushings of HVDC converter transformer and application in the evaluation of current-carrying connections defects; 2020-Novel heat pipe current-carrying tube of RIP valve-side bushing in converter transformer,local diagnostic/contact-degradation candidates; method reference still needed,false,false,true,,,LOCAL_PATH_ONLY_NOT_PORTABLE,4.3; 4.7,Find diagnostic screening/risk-zoning method support.,No formal reference entry is emitted unless source metadata and claim support are verified.
