placeholder,source_status_from_RUN015,manual_task,priority,acceptable_source,unacceptable_source,affected_sections,can_submit_without_resolution,notes
[REF_BRFG_DRAWING],LOCAL_FILE_FOUND_NEEDS_MANUFACTURER_METADATA_CONFIRMATION,Confirm manufacturer metadata / authorized drawing provenance.,high,Manufacturer drawing/catalog or authorized CAD record.,Unlabeled local screenshot or unverified dimension copy.,1; 3.1,NO_FOR_FINAL_SUBMISSION; YES_FOR_PLACEHOLDER_DRAFT,Use only after confirming drawing provenance and permissions; do not infer manufacturer name if not in file metadata.
[REF_IEC_60137],TRACEABILITY_RECORD_EXISTS_NEEDS_STANDARD_TEXT_CONFIRMATION,Confirm official IEC 60137 text or official scope page.,high,Official IEC standard or official IEC page.,Untraceable secondary quote.,1; 3.1,NO_FOR_FINAL_SUBMISSION; YES_FOR_PLACEHOLDER_DRAFT,Do not quote clauses or limits until the official standard text is checked.
[REF_RIP_BUSHING_THERMAL],LOCAL_PDF_CANDIDATES_FOUND_NEEDS_CONTENT_AND_BIBLIOGRAPHIC_CONFIRMATION,Verify local RIP/bushing thermal literature and final bibliographic metadata.,medium,Peer-reviewed bushing thermal/electro-thermal paper.,Unrelated insulation or cable-joint paper.,1; 2; 3.2,NO_FOR_FINAL_SUBMISSION; YES_FOR_PLACEHOLDER_DRAFT,"Filenames support relevance only; final bibliography must verify journal, DOI, and exact claims."
[REF_DIELECTRIC_LOSS_THEORY],PARTIALLY_RESOLVED_WITH_LOCAL_PDFS_NEEDS_THEORY_REFERENCE_CONFIRMATION,Confirm dielectric-loss equation and RMS convention.,high,"Textbook, standard, or peer-reviewed dielectric theory source.",Formula-only web page without convention.,2; 3.3; 4.4,NO_FOR_FINAL_SUBMISSION; YES_FOR_PLACEHOLDER_DRAFT,Local papers may support material response; equation should be checked against a theory source and RMS convention.
[REF_CONDENSER_BUSHING_ELECTROSTATICS],LOCAL_PDF_CANDIDATES_FOUND_NEEDS_CONTENT_AND_BIBLIOGRAPHIC_CONFIRMATION,Verify condenser-screen electrostatic modeling support.,medium,Peer-reviewed condenser bushing electrostatics/electro-thermal paper.,Generic capacitor reference without bushing relevance.,2; 3.3,NO_FOR_FINAL_SUBMISSION; YES_FOR_PLACEHOLDER_DRAFT,Need verify that selected paper actually discusses screen/electrostatic implementation.
[REF_COMSOL_FLOATING_POTENTIAL],UNRESOLVED,Find official COMSOL Floating Potential / zero net charge documentation.,high,Official COMSOL documentation.,Forum posts or unofficial tutorials as primary source.,3.3,NO_FOR_FINAL_SUBMISSION; YES_FOR_PLACEHOLDER_DRAFT,Requires manual or later online lookup of official COMSOL Electrostatics documentation.
[REF_MESH_CONVERGENCE],UNRESOLVED,Find finite-element mesh convergence verification reference.,high,Numerical-method textbook/guideline or peer-reviewed FEM verification paper.,Claim that mesh convergence proves physical validation.,3.5; 4.6,NO_FOR_FINAL_SUBMISSION; YES_FOR_PLACEHOLDER_DRAFT,Internal data prove convergence for this model; external source is still needed for manuscript framing.
[REF_RISK_DIAGNOSTIC_METHOD],PARTIALLY_RESOLVED_WITH_LOCAL_APPLICATION_PDFS_NEEDS_METHOD_REFERENCE,Find diagnostic screening/risk-zoning method support.,medium,Risk-screening or diagnostic threshold method reference.,Standard-limit source misused as project threshold.,4.3; 4.7,NO_FOR_FINAL_SUBMISSION; YES_FOR_PLACEHOLDER_DRAFT,Use for engineering motivation only unless the candidate explicitly supports risk-zoning methodology.
